"Social lane-based cognitive model for simulating pedestrian flow in games","D. J. Howden; S. Y. Chen","Centre for Information Technology Research, Swinburne University of Technology, Melbourne, Australia; School of Information Technology, York University, Toronto, Canada","2013 IEEE Congress on Evolutionary Computation","15 Jul 2013","2013","","","837","843","In computer game software, the implementation of simulated urban crowds is widespread. Representation of pedestrians in computer games has, to date, lagged behind what has been shown possible in academic studies and simulation software. Primary reasons for this are the strict CPU budgets that game AI has to function under, and algorithm implementation which is frequently complex for even a baseline approach (i.e. before performance optimisations). This paper presents a novel lane-based approach to pedestrian AI which combines the verisimilitude of AI based on behavioural studies, with the intuitive implementation and minimal computation cost required for games development. To achieve this, each agent filters its surroundings into virtual lanes, and then sidesteps or continues forward as dictated by social convention.","1941-0026","978-1-4799-0454-9","10.1109/CEC.2013.6557655","","https://ieeexplore.ieee.org/stamp/stamp.jsp?arnumber=6557655","Lane;pedestrian;game;embodiment;social;crowd;artificial life;simulation","Games;Artificial intelligence;Computational modeling;Planning;Decision trees;Navigation;Collision avoidance","","1","","20","IEEE","15 Jul 2013","","","IEEE","IEEE Conferences"
"Deep Learning Framework for Student Course Recommender System for Higher Educational Institutions","S. Rallapalli; D. M. R","Department of Master of Computer Applications, Nitte Meenakshi Institute of Technology, Bengaluru, India; Department of Master of Computer Applications, Nitte Meenakshi Institute of Technology, Bengaluru, India","2023 International Conference on Ambient Intelligence, Knowledge Informatics and Industrial Electronics (AIKIIE)","22 Jan 2024","2023","","","1","6","With the advancement in technology like Artificial Intelligence (AI) and Machine Learning (ML) there are many sub fields which are emerged from the core areas. Deep Learning (DL) is one such field which is gaining vast importance and is often mentioned as branch of ML and AI. In order to quickly and efficiently find the relevant information on the internet based on our past browsing history, recommender systems are playing a major role. Many such systems has been proposed in recent works. Recommender system has been implemented in major E-commerce sites like Amazon, Flipkart, Netflix, YouTube and many other giants have introduced AI based recommendation systems. Most of these systems uses the algorithms which can efficiently collect user behavioral data, filter it and recommends the user various choices based on the previous data. These systems often need to develop their own framework and algorithms which can solve the purpose. Students are often confused to opt for courses out of various options available in today's digital world. Based on their skill, interest the system should recommend a course. A general framework where it can handle data diversity, various dimensions and stimulation types is needed. Deep learning based generalized framework can solve such type of issues. In this paper we propose such generalized and effective Deep learning framework for a student course recommendation system for students who wish to pursue a course in various Higher Educational Institutions. The recommender system can be useful for the students who wish to opt a particular course based on their past history of interest and data collected from the logs. In this paper we use the Intel OpenVino toolkit for the deployment of the recommender system. The recommender system which is based on deep learning will provide the student with the exact set of modules he need to choose based on his skill set. The result of a student recommender system using deep learning can vary depending on several factors, including the quality of the data, the effectiveness of the model, and the specific goals of the recommender system. In this paper we focused on better performance, personalized learning paths and enhanced student satisfaction.","","979-8-3503-1646-9","10.1109/AIKIIE60097.2023.10390085","","https://ieeexplore.ieee.org/stamp/stamp.jsp?arnumber=10390085","Algorithms;Artificial Intelligence;Deep Learning Framework;Machine Learning;Recommender System","Deep learning;Industrial electronics;Video on demand;Optimized production technology;Predictive models;Prediction algorithms;History","","","","27","IEEE","22 Jan 2024","","","IEEE","IEEE Conferences"
"A Marketplace Solution for Distributed Network Management and Orchestration of Slices","E. Zeydan; L. Blanco; S. Barrachina-Muñoz; F. Rezazadeh; L. Vettori; J. Mangues","Centre Tecnològic de Telecomunicacions de Catalunya (CTTC), Barcelona, Spain; Centre Tecnològic de Telecomunicacions de Catalunya (CTTC), Barcelona, Spain; Centre Tecnològic de Telecomunicacions de Catalunya (CTTC), Barcelona, Spain; Centre Tecnològic de Telecomunicacions de Catalunya (CTTC), Barcelona, Spain; Centre Tecnològic de Telecomunicacions de Catalunya (CTTC), Barcelona, Spain; Centre Tecnològic de Telecomunicacions de Catalunya (CTTC), Barcelona, Spain","2023 19th International Conference on Network and Service Management (CNSM)","28 Nov 2023","2023","","","1","6","The H2020 Distributed management of Network Slices in beyond 5G(MonB5G) project aims to provide zero-touch management and orchestration to support network slicing at scale to reduce the management burden on mobile operators by leveraging distribution of operations along with advanced data-driven Artificial Intelligence (AI)-based mechanisms. However, while this approach shows promise and large companies with abundant data and ML expertise are developing powerful MLdriven services, a critical aspect that remains to be analyzed is its business case. The vast majority of potentially valuable ML services, such as predictive maintenance, Quality of Service (QoS) optimization, network security enhancements, remain stuck at the idea or prototype stage. This paper delves into an analysis of how the MonB5G solutions in particular the tuples (Monitoring System (MS), Analytics Engine (AE), Decision Engine (DE) and Actuator (ACT) could be applied within the network management and orchestration market while investigating various business models and value chains. Numerical results based on experimental data have also been performed to evaluate the OpEX (Operational Expenditure) benefits associated with different network management techniques, for centralized and distributed systems.","2165-963X","978-3-903176-59-1","10.23919/CNSM59352.2023.10327832","","https://ieeexplore.ieee.org/stamp/stamp.jsp?arnumber=10327832","business models;network slicing;network management;closed loop","Technological innovation;Network slicing;Prototypes;Quality of service;Numerical models;Engines;Commercialization","","","","13","","28 Nov 2023","","","IEEE","IEEE Conferences"
"Data-driven Transient Stability Assessment Using Sparse PMU Sampling and Online Self-check Function","G. Wang; J. Guo; S. Ma; X. Zhang; Q. Guo; S. Fan; H. Xu","Department of Electrical Engineering, Tsinghua University, Beijing, China; Department of Power System, China Electric Power Research Institute, Beijing, China; Department of Power System, China Electric Power Research Institute, Beijing, China; School of Automation, Beijing Institute of Technology, Beijing, China; Department of Electrical Engineering, Tsinghua University, Beijing, China; Department of Power System, China Electric Power Research Institute, Beijing, China; Department of Power System, China Electric Power Research Institute, Beijing, China","CSEE Journal of Power and Energy Systems","5 Jun 2023","2023","9","3","910","920","Artificial intelligence technologies provide a new approach for the real-time transient stability assessment (TSA) of large-scale power systems. In this paper, we propose a data-driven transient stability assessment model (DTSA) that combines different AI algorithms. A pre-AI based on the time-delay neural network is designed to locate the dominant buses for installing the phase measurement units (PMUs) and reducing the data dimension. A post-AI is designed based on the bidirectional long-short-term memory network to generate an accurate TSA with sparse PUM sampling. An online self-check function of the online TSA's validity when the power system changes is further added by comparing the results of the pre-AI and the post-AI. The IEEE 39-bus system and the 300-bus AC/DC hybrid system established by referring to China's existing power system are adopted to verify the proposed method. Results indicate that the proposed method can effectively reduce the computation costs with ensured TSA accuracy as well as provide feedback for its applicability. The DTSA provides new insights for properly integrating varied AI algorithms to solve practical problems in modern power systems.","2096-0042","","10.17775/CSEEJPES.2021.05890","National Key R&D Program of China(grant numbers:2018AAA0101500); ","https://ieeexplore.ieee.org/stamp/stamp.jsp?arnumber=9682673","Artificial intelligence;phasor measurement units;recurrent neural networks;transient stability assessment","Power system stability;Phasor measurement units;Transient analysis;Training;Stability criteria;Satellite broadcasting;Feature extraction","","","","28","","14 Jan 2022","","","CSEE","CSEE Journals"
"Implication and Advantages of Machine Learning-based Chatbots in Diverse Disciplines","V. Asha; G. P. Reddy; B. Nithya; K. Tungal; V. Durgaprasad; T. N. Kruthik","Department of MCA, New Horizon College of Engineering, Bengaluru, India; Department of MCA, New Horizon College of Engineering, Bengaluru, India; Department of MCA, New Horizon College of Engineering, Bengaluru, India; Department of MCA, New Horizon College of Engineering, Bengaluru, India; Department of MCA, New Horizon College of Engineering, Bengaluru, India; Department of MCA, New Horizon College of Engineering, Bengaluru, India","2023 International Conference on Sustainable Computing and Data Communication Systems (ICSCDS)","25 Apr 2023","2023","","","22","28","Artificial Intelligence (AI) and Machine Learning (ML) are the techniques, which helps in enacting system with the human beings. Now a days chatbots are playing a vital role in changing the mode of conversation between humans and computer systems. The implementation of these chatbots helps to improve the conversation between computers and humans. Chatbots are the software programmed virtual machines which are intended to make ready for building conversation with the humans and to deploy this system the Artificial Intelligence (AI) techniques are used in all the message plans, these virtual machines are not only bounded for only one area but can be used in many of the areas like education sector, medical, social media, banking and finance etc. Chatbots are essential in educational institutes for handling administrative activities. Chatbots acts as a platform for solving queries of individual with ease. Natural Language input and the deep neural networks are the major tools, which are used in the development of these chatbots. These tools use a LSTM mechanism to understand the related user query. By using these techniques, the chatbots are trained and that helps in giving instantaneous answers for the user queries. All the data from the user will be collected and stored in the specified database and that data will be used for further references. This study depicts the importance of chatbots in various fields with their working principle using Machine Learning(ML) and Artificial Intelligence (AI)-based algorithms.","","978-1-6654-9199-0","10.1109/ICSCDS56580.2023.10104649","","https://ieeexplore.ieee.org/stamp/stamp.jsp?arnumber=10104649","Chatbot;Natural Language Processing (NLP);Training data;Machine Learning;Deep Learning;Long Short-Term Memory (LSTM)","Machine learning algorithms;Social networking (online);Neural networks;Natural languages;Education;Finance;Oral communication","","","","16","IEEE","25 Apr 2023","","","IEEE","IEEE Conferences"
"Production Flow Analysis in the Era of Industry 4.0 : How Digital Technologies can Support Decision-Making in the Factory of the Future","L. Tomidei; N. Sick; J. Deuse; L. Clemon","Faculty of Engineering and IT, Centre for Advanced Manufacturing, University of Technology Sydney, Australia; Faculty of Engineering and IT, Centre for Advanced Manufacturing, University of Technology Sydney, Australia; Faculty of Engineering and IT, Centre for Advanced Manufacturing, University of Technology Sydney, Australia; Faculty of Engineering and IT, Centre for Advanced Manufacturing, University of Technology Sydney, Australia","2022 Portland International Conference on Management of Engineering and Technology (PICMET)","14 Sep 2022","2022","","","1","15","In the context of Industry 4.0, manufacturing companies have been increasingly adopting digital technologies such as Internet of Things, data analytics and cyber-physical systems to seize opportunities for productivity improvements. At the same time, established manufacturing philosophies such as Group Technology have assisted companies in managing the complexity of production processes for decades. To support manufacturing management with more informed decision-making tools, the literature has been proposing new approaches that exploit the potential of digital technologies to enhance the effectiveness of traditional manufacturing techniques. This study focuses on Production Flow Analysis (PFA) as an established approach for Group Technology. Although the existing literature has been focusing on Artificial Intelligence (AI) based approaches to plan the change to Group Technology for decades, few studies rely on production data directly extracted from the factory floor. This is partly due to the fact that technologies such as sensors and data analytics have been increasingly adopted in recent years, and this has led to an increasing amount of data that can be exploited to develop models that can support decisions. In particular, in the context of Industry 4.0, process mining has gained increasing interest, as it provides a data-driven methodology to capture real production processes. The goal of this study is to explore how PFA has evolved in the last decade thanks to the adoption of digital technologies, and to investigate potential synergies between PFA and process mining. This study uses a structured literature review to map advances in industrial applications of PFA in relation to digital technologies, as well as process mining applications in manufacturing to present a future research agenda. This provides manufacturing managers with a structured overview of existing industrial applications and the digital technologies adopted to enhance decision-making tools.","2159-5100","978-1-890843-41-0","10.23919/PICMET53225.2022.9882711","","https://ieeexplore.ieee.org/stamp/stamp.jsp?arnumber=9882711","","Group technology;Analytical models;Decision making;Production;Companies;Production facilities;Data models","","","","151","","14 Sep 2022","","","IEEE","IEEE Conferences"
"Defining Quality Requirements for a Trustworthy AI Wildflower Monitoring Platform","P. Heck; G. Schouten","Fontys University of Applied Science, Eindhoven, The Netherlands; Fontys University of Applied Science, Eindhoven, The Netherlands","2023 IEEE/ACM 2nd International Conference on AI Engineering – Software Engineering for AI (CAIN)","4 Jul 2023","2023","","","119","126","For an AI solution to evolve from a trained machine learning model into a production-ready AI system, many more things need to be considered than just the performance of the machine learning model. A production-ready AI system needs to be trustworthy, i.e. of high quality. But how to determine this in practiceƒ For traditional software, ISO25000 and its predecessors have since long time been used to define and measure quality characteristics. Recently, quality models for AI systems, based on ISO25000, have been introduced. This paper applies one such quality model to a real-life case study: a deep learning platform for monitoring wildflowers. The paper presents three realistic scenarios sketching what it means to respectively use, extend and incrementally improve the deep learning platform for wildflower identification and counting. Next, it is shown how the quality model can be used as a structured dictionary to define quality requirements for data, model and software. Future work remains to extend the quality model with metrics, tools and best practices to aid AI engineering practitioners in implementing trustworthy AI systems.","","979-8-3503-0113-7","10.1109/CAIN58948.2023.00029","Naturalis Biodiversity Center; ","https://ieeexplore.ieee.org/stamp/stamp.jsp?arnumber=10164774","Index Terms—software product quality;trustworthy AI;quality requirements;biodiversity monitoring;wildflowers","Deep learning;Dictionaries;Data models;Software;Time measurement;Software measurement;Artificial intelligence","","","","26","IEEE","4 Jul 2023","","","IEEE","IEEE Conferences"
"Deep Recurrent Learning versus Q-Learning for Energy Management Systems in Next Generation Network","A. Dridi; C. Boucetta; H. Moungla; H. Afifi","SAMOVAR Lab. Telecom SudParis, Institut Polytechnique de Paris, Palaiseau, France; CReSTIC EA 3804, Université de Reims Champagne-Ardenne, REIMS, France; LIPADE, University of Paris, Paris, France; SAMOVAR Lab. Telecom SudParis, Institut Polytechnique de Paris, Palaiseau, France","2021 IEEE Global Communications Conference (GLOBECOM)","2 Feb 2022","2021","","","1","6","An AI based energy management system (EMS) for microgrids is proposed. It is composed of three modules: a strategy based module, a deep learning (DL) and a reinforcement learning module (RL). This framework determines heuristically the optimal actions for the microgrid system under different time-dependent environmental conditions. In essence, a main innovation is applied to the EMS. Our deep learning algorithm uses recurrent neural networks (RNNs) instead of the habitual State Action Reward (SAR) approach (whether classical or deep). Learning is hence guided by successful actions rather than by blind exploration. A large improvement in learning rates is hence observed when compared to classical Q-learning on real datasets that present a large diversity in energy consumption profiles, acquired in French premises over a long period. It leads to question about the best appropriate reinforcement policies to adopt when solving large state environments.","","978-1-7281-8104-2","10.1109/GLOBECOM46510.2021.9685620","","https://ieeexplore.ieee.org/stamp/stamp.jsp?arnumber=9685620","Reinforcement Learning;Deep reinforcement Learning;Q-Learning;Smart Microgrid;Optimization","Deep learning;Energy consumption;Technological innovation;Q-learning;Recurrent neural networks;Microgrids;Prediction algorithms","","","","16","IEEE","2 Feb 2022","","","IEEE","IEEE Conferences"
"Advancing Cybersecurity with Explainable Artificial Intelligence: A Review of the Latest Research","P. Ramya; S. V. Babu; G. Venkatesan","Department of AI and DS, PSNA College of Engineering and Technology, Dindigul, India; Department of CSE, SNS College of Engineering, Coimbatore, India; Department of EEE, Sri Sai Ram Engineering College, Chennai, India","2023 5th International Conference on Inventive Research in Computing Applications (ICIRCA)","28 Aug 2023","2023","","","1351","1357","The use of artificial intelligence (AI) in cybersecurity has become increasingly common, but a key challenge is the lack of transparency and interpretability of AI models. Explainable Artificial Intelligence (XAI) can address this issue by providing a means of enhancing the transparency and interpretability of AI models, enabling cybersecurity professionals to better understand the decisions made by these models and to identify errors or biases. This review article provides a comprehensive overview of the latest research on the application of Explainable Artificial Intelligence (XAI) in the context of cybersecurity, with a focus on its benefits and challenges. Specifically, it analyses the most recent techniques and tools for implementing XAI in cybersecurity, while also highlighting several successful use cases. Furthermore, it delves into the ethical and regulatory considerations associated with XAI in cybersecurity and provides recommendations for future research in this area. The ultimate objective of this review article is to furnish cybersecurity professionals with a detailed understanding of the potential of XAI to enhance the efficacy of AI-based tools in cybersecurity, underscoring the significance of transparency and interpretability in assuring the security and dependability of AI systems.","","979-8-3503-2142-5","10.1109/ICIRCA57980.2023.10220797","","https://ieeexplore.ieee.org/stamp/stamp.jsp?arnumber=10220797","Explainable Artificial Intelligence;Intrusion Detection System;Botnet;Cybersecurity","Ethics;Law;Collaboration;Standardization;Cognition;Stakeholders;Reliability","","","","32","IEEE","28 Aug 2023","","","IEEE","IEEE Conferences"
"Agent Architecture for Adaptive Behaviors in Autonomous Driving","M. D. Lio; R. Donà; G. P. R. Papini; K. Gurney","Department of Industrial Engineering, University of Trento, Trento, Italy; Department of Industrial Engineering, University of Trento, Trento, Italy; Department of Industrial Engineering, University of Trento, Trento, Italy; Department of Psychology, The University of Sheffield, Sheffield, U.K.","IEEE Access","1 Sep 2020","2020","8","","154906","154923","Evolution has endowed animals with outstanding adaptive behaviours which are grounded in the organization of their sensorimotor system. This paper uses inspiration from these principles of organization in the design of an artificial agent for autonomous driving. After distilling the relevant principles from biology, their functional role in the implementation of an artificial system are explained. The resulting Agent, developed in an EU H2020 Research and Innovation Action, is used to concretely demonstrate the emergence of adaptive behaviour with a significant level of autonomy. Guidelines to adapt the same principled organization of the sensorimotor system to other agents for driving are also obtained. The demonstration of the system abilities is given with example scenarios and open access simulation tools. Prospective developments concerning learning via mental imagery are finally discussed.","2169-3536","","10.1109/ACCESS.2020.3007018","European Commission through the EU Horizon 2020 Dreams4Cars Research and Innovation Action Project(grant numbers:H2020 731593); ","https://ieeexplore.ieee.org/stamp/stamp.jsp?arnumber=9133080","Adaptive behaviour;affordance competition hypothesis;autonomous driving;explainable artificial intelligence","Trajectory;Organizations;Autonomous vehicles;Brain modeling;Computational modeling;Computer architecture","","13","","52","CCBY","3 Jul 2020","","","IEEE","IEEE Journals"
