"On STPA for Distributed Development of Safe Autonomous Driving: An Interview Study","A. Nouri; C. Berger; F. Törner","Volvo Cars, Gothenburg, Sweden; Sweden Department of Computer Science and Engineering, University of Gothenburg; Volvo Cars, Gothenburg, Sweden","2023 49th Euromicro Conference on Software Engineering and Advanced Applications (SEAA)","1 Jan 2024","2023","","","5","12","Safety analysis is used to identify hazards and build knowledge during the design phase of safety-relevant functions. This is especially true for complex AI-enabled and software intensive systems such as Autonomous Drive (AD). System-Theoretic Process Analysis (STPA) is a novel method applied in safety-related fields like defense and aerospace, which is also becoming popular in the automotive industry. However, STPA assumes prerequisites that are not fully valid in the automotive system engineering with distributed system development and multi-abstraction design levels. This would inhibit software developers from using STPA to analyze their software as part of a bigger system, resulting in a lack of traceability. This can be seen as a maintainability challenge in continuous development and deployment (DevOps). In this paper, STPA’s different guidelines for the automotive industry, e.g. J31887/ISO21448/STPA handbook, are firstly compared to assess their applicability to the distributed development of complex AI-enabled systems like AD. Further, an approach to overcome the challenges of using STPA in a multilevel design context is proposed. By conducting an interview study with automotive industry experts for the development of AD, the challenges are validated and the effectiveness of the proposed approach is evaluated.","2376-9521","979-8-3503-4235-2","10.1109/SEAA60479.2023.00011","","https://ieeexplore.ieee.org/stamp/stamp.jsp?arnumber=10371692","System Theoretic Process Analysis;STPA;safety-related function;autonomous driving;functional safety (FUSA);safety of the intended function (SOTIF)","Industries;DevOps;Systems engineering and theory;Software;Hazards;Interviews;Autonomous vehicles","","","","16","IEEE","1 Jan 2024","","","IEEE","IEEE Conferences"
"Neuromorphic Near-Sensor Computing: From Event-Based Sensing to Edge Learning","A. Safa; J. Van Assche; M. D. Alea; F. Catthoor; G. G. E. Gielen","IMEC and KU Leuven, Leuven, Belgium; KU Leuven, Leuven, Belgium; KU Leuven, Leuven, Belgium; IMEC and KU Leuven, Leuven, Belgium; IMEC and KU Leuven, Leuven, Belgium","IEEE Micro","31 Oct 2022","2022","42","6","88","95","Neuromorphic near-sensor computing has recently emerged as a low-power and low-memory paradigm for the design of artificial intelligence (AI)-enabled IoT devices working at the extreme edge. Compared to conventional sensing and learning techniques, neuromorphic sampling, and processing reduces data bandwidth requirements, induces large savings on power and area consumption, and enables online learning and adaptation. In this article, we discuss recent studies made in the design of event-based sampling and learning circuits. We show that our event-based sampling methods outperform conventional techniques in terms of power consumption. We also show that our spiking neural network (SNN), learning through spike-timing-dependent plasticity (STDP), outperforms the state-of-the-art SNN-STDP systems in terms of inference accuracy while being orders of magnitude more power efficient than conventional deep-learning systems. We hope that the opportunities discussed in this summary article will inspire future research.","1937-4143","","10.1109/MM.2022.3195634","Flemish Government; INTUITIVE—EU Horizon 2020 project(grant numbers:861166); KUL internal; ","https://ieeexplore.ieee.org/stamp/stamp.jsp?arnumber=9847074","","Neurons;Neuromorphics;Encoding;Sensors;Cameras;System-on-chip;Power demand;Low power electronics;Event detection;Edge computing","","4","","18","IEEE","1 Aug 2022","","","IEEE","IEEE Magazines"
"A New Fracture Liaison Service Using the Mobile Application and IoT Sensor","S. -W. Kim; Y. -J. Won; D. -S. Chae; H. -J. Chang","Cardio-vascular Information Communication Technology Research Center, Yonsei University College of Medicine, Seoul, South Korea; Cardio-vascular Information Communication Technology Research Center, Yonsei University College of Medicine, Seoul, South Korea; Cardio-vascular Information Communication Technology Research Center, Yonsei University College of Medicine, Seoul, South Korea; Cardio-vascular Information Communication Technology Research Center, Yonsei University College of Medicine, Seoul, South Korea","2019 41st Annual International Conference of the IEEE Engineering in Medicine and Biology Society (EMBC)","7 Oct 2019","2019","","","3486","3489","While the clinical design of a Fracture Liaison Service(FLS) has been used as a localized healthcare service in a previous study, thus far there has not been an international mobile application, such as a FLS using smart phones. In addition, we developed a safety monitoring system using IoT sensor for a smart wheelchair. Our FLS is able to give patient various fall-related predictions with a safety monitoring system on this mobile application. The goal of our study is to improve the prevention of secondary fractures from our FLS application. We have developed a Fracture Liaison Service as an Android-OS application and released this service as a secondary fracture prevention program for osteoporotic fracture patients. We have released the final version of the FLS mobile application in Google's PlayStore. The new model of the FLS mobile application can be practically commercialized, and the effective second-order fracture prevention system is based on an open policy platform. We hope to contribute to the prevention and management of osteoporotic fractures and osteoporosis worldwide via this FLS mobile application. In the future, an intelligent personal FLS is definitely possible, by applying a Medical AI based on a huge DB.","1558-4615","978-1-5386-1311-5","10.1109/EMBC.2019.8857094","","https://ieeexplore.ieee.org/stamp/stamp.jsp?arnumber=8857094","FLS;osteoporosis;fracture prevention;patient education;smartphone applications;IoT sensor","Wheelchairs;Guidelines;Safety;Monitoring;Osteoporosis;Mobile applications","Bone Density Conservation Agents;Humans;Mobile Applications;Osteoporosis;Osteoporotic Fractures;Secondary Prevention","","","12","IEEE","7 Oct 2019","","","IEEE","IEEE Conferences"
"Sea-battlefield situation assessment based on a new method combining dynamic Bayesian network with pattern matching","J. Ma; L. Liu","National Key Laboratory of Science and Technology on Integrated Control Technology Beihang University, Beijing, China; National Key Laboratory of Science and Technology on Integrated Control Technology Beihang University, Beijing, China","Proceedings of 2014 IEEE Chinese Guidance, Navigation and Control Conference","15 Jan 2015","2014","","","1764","1769","Sea-battlefield situation is a dynamic, nonlinear and multi-dimensional system where Artificial Intelligence (AI) system has a good role to play. Bayesian Network has a strong knowledge skills and reasoning ability to solve the problem of sea-battlefield situation assessment. After constructing the network, giving the probability, considering the time factor and then combining with Pattern Matching using a rule set, sea-battlefield situation assessment can be achieved. The knowledge representation will be discussed and how to complete reasoning through Bayesian Network and Pattern Matching will be researched. In the end, a simulation will illustrate the combining method has a good performance in sea-battle-field situation assessment.","","978-1-4799-4699-0","10.1109/CGNCC.2014.7007450","","https://ieeexplore.ieee.org/stamp/stamp.jsp?arnumber=7007450","Sea-battlefield;Situation assessment;Bayesian Network;Pattern Matching","Bayes methods;Pattern matching;Cognition;Aircraft;Real-time systems;Meteorology;Time factors","","2","","18","IEEE","15 Jan 2015","","","IEEE","IEEE Conferences"
"Driving style imitation in simulated car racing using style evaluators and multi-objective evolution of a fuzzy logic controller","T. Wang; K. -T. Liaw","Department of Computer Science, National Chiao Tung University, Hsinchu City, Taiwan, R.O.C.; Department of Computer Science, National Chiao Tung University, Hsinchu City, Taiwan, R.O.C.","2014 IEEE Conference on Norbert Wiener in the 21st Century (21CW)","8 Sep 2014","2014","","","1","7","This paper describes a new approach to driving style imitation in simulated car racing games. Our goal is to be able to create non-personal characters (NPCs) that both run competitively and exhibit some driving style traits of the player being imitated. We introduce a style evaluator function that can measure the style similarity between driving records even from different tracks. The effectiveness of such style evaluators are verified using driving records of both NPCs and human players. To build NPC drivers that can imitate particular human players, we use a base driver AI based on a fuzzy logic controller and optimizes its parameters using multi-objective evolution. This is the first work on driver imitation that actually allows several human players to drive in their only natural, not instructed, styles. Our results show evidences that the created imitator NPCs do possess traits of styles of the respective human players being modeled.","","978-1-4799-4562-7","10.1109/NORBERT.2014.6893872","","https://ieeexplore.ieee.org/stamp/stamp.jsp?arnumber=6893872","simulated car racing;TORCS;fuzzy rules;multi-objective evolution;computer games;player imitation","Target tracking;Acceleration;Sensors;Games;Training;Vehicles;Accidents","","4","","14","IEEE","8 Sep 2014","","","IEEE","IEEE Conferences"
"An Explainable AI Model for Interpretable Lung Disease Classification","V. Pitroda; M. M. Fouda; Z. M. Fadlullah","Department of Computer Science, Lakehead University, Thunder Bay, Ontario, Canada; Department of Electrical and Computer Engineering, Idaho State University, Pocatello, ID, USA; Department of Computer Science, Lakehead University, Thunder Bay, Ontario, Canada","2021 IEEE International Conference on Internet of Things and Intelligence Systems (IoTaIS)","7 Dec 2021","2021","","","98","103","In this paper, we develop a framework for lung disease identification from chest X-ray images by differentiating the novel coronavirus disease (COVID-19) or other disease-induced lung opacity samples from normal cases. We perform image processing tasks, segmentation, and train a customized Convolutional Neural Network (CNN) that obtains reasonable performance in terms of classification accuracy. To address the black-box nature of this complex classification model, which emerged as a key barrier to applying such Artificial Intelligence (AI)-based methods for automating medical decisions raising skepticism among clinicians, we address the need to quantitatively interpret the performance of our adopted approach using a Layer-wise Relevance Propagation (LRP)-based method. We also used a pixel flipping-based, robust performance metric to evaluate the explainability of our adopted LRP method and compare its performance with other explainable methods, such as Local Interpretable Model Agnostic Explanation (LIME), Guided Backpropagation (GB), and Deep Taylor Decomposition (DTD).","","978-1-6654-2035-8","10.1109/IoTaIS53735.2021.9628573","","https://ieeexplore.ieee.org/stamp/stamp.jsp?arnumber=9628573","Deep learning;explainable AI;Layer-wise Relevance Propagation;LIME;Deep Taylor Decomposition;Guided Backpropagation;medical diagnosis;chest X-ray;COVID-19","Measurement;COVID-19;Pulmonary diseases;Lung;Bones;Convolutional neural networks;Artificial intelligence","","7","","23","IEEE","7 Dec 2021","","","IEEE","IEEE Conferences"
"An Overview of Fuzzy Logic Approaches for Fault Diagnosis in Energy Conversion Devices","G. Demidova; A. Rassõlkin; T. Vaimann; A. Kallaste; J. Zakis; A. Suzdalenko","Department of Electrical Power Engineering and Mechatronics, Tallinn University of Technology, Tallinn, Estonia; Department of Electrical Power Engineering and Mechatronics, Tallinn University of Technology, Tallinn, Estonia; Department of Electrical Power Engineering and Mechatronics, Tallinn University of Technology, Tallinn, Estonia; Department of Electrical Power Engineering and Mechatronics, Tallinn University of Technology, Tallinn, Estonia; Institute of Industrial Electronics and Electrical Engineering, Riga Technical University, Riga, Latvia; Institute of Industrial Electronics and Electrical Engineering, Riga Technical University, Riga, Latvia","2021 28th International Workshop on Electric Drives: Improving Reliability of Electric Drives (IWED)","22 Mar 2021","2021","","","1","7","Any energy conversion devices, such as industrial motor-drives, propulsion drives of electric vehicles, pump systems, wind turbines, and others, are prone to failures. Usually, failures result in increased economic costs that come through additional energy losses, loss of production, or in a worst-case even environmental hazard. To prevent failures, energy conversion systems may be checked through particular routines developed and specified by the manufactures. However, it may be challenging due to the complex construction of energy conversion devices or devices' failure between the routine checks. Such schedule-based condition monitoring approaches provide minor information on the remaining lifetime (separate components and whole system) of the devices and do not allow proper prognostic or full exploitation. To overcome traditional two-level Boolean approaches with healthy/faulty states an Artificial Intelligence (AI)-based control techniques are used. The Fuzzy Logic approach is based on inspired by human perception processes and cognition that are often uncertain or empirical. However, Fuzzy Logic is already successfully applied in various control applications of energy conversion devices, even when the analytical models are unknown. This paper argues for developing new fault detection algorithms based on fuzzy logic methods to allow energy conversion systems designers to develop reliability factors for apparatus, which included electrical machines and power electronics subsystems.","","978-1-6654-1456-2","10.1109/IWED52055.2021.9376389","EEA(grant numbers:2014–2021); ","https://ieeexplore.ieee.org/stamp/stamp.jsp?arnumber=9376389","fuzzy logic;fault-tolerant control;fault diagnosis;fault detection","Fuzzy logic;Condition monitoring;Digital twin;Energy conversion;Propulsion;Reliability engineering;Wind turbines","","3","","58","IEEE","22 Mar 2021","","","IEEE","IEEE Conferences"
"Verification of Intelligent Transportation Systems: Challenges And Possibilities","I. Phillips; R. Kenley","School of Industrial Engineering, Purdue University, West Lafayette, USA; School of Industrial Engineering, Purdue University, West Lafayette, USA","2022 17th Annual System of Systems Engineering Conference (SOSE)","6 Jul 2022","2022","","","127","131","Intelligent Transportation Systems (ITS) have been touted and proven to be an advanced-technology improvement in transport systems and commuters’ operational performance, efficiency, and safety. The nature of ITS as an integrated metasystem of information and data, operational management, safety, ICT infrastructure, and logistic systems permits their observation as a System of Systems (SoS). In addition, the prevalence of real-time information processing and the subsequent data explosion requires the utilization of Artificial Intelligence (AI) solutions. ITS characteristics depict them as AIbased SoS, which presents challenges to the verification and certification of these systems. This paper will frame ITS as Systems of Systems, considering their SoS classification from literature while outlining the role of AI applications in fostering effective and adequate mobility for these systems. With the understanding of the architecture and nature of ITS, it becomes easier to understand how the emergence and the complexity of modeling and evaluating these systems, among other challenges, contribute to the verification difficulty that will be encountered – key to certifying these systems. We propose some solutions from literature meant to serve as components of a holistic suite of solutions towards resolving the verification challenges posed by AI-based Systems of Systems like ITS.","","978-1-6654-9623-0","10.1109/SOSE55472.2022.9812702","","https://ieeexplore.ieee.org/stamp/stamp.jsp?arnumber=9812702","Intelligent Transportation Systems;System of Systems;Artificial Intelligence;Verification;Challenges","Transportation;Information processing;Real-time systems;Safety;Information and communication technology;Artificial intelligence;Certification","","2","","39","IEEE","6 Jul 2022","","","IEEE","IEEE Conferences"
"GitHub Considered Harmful? Analyzing Open-Source Projects for the Automatic Generation of Cryptographic API Call Sequences","C. Tony; N. E. Díaz Ferreyra; R. Scandariato","Institute of Software Security, Hamburg University of Technology, Hamburg, Germany; Institute of Software Security, Hamburg University of Technology, Hamburg, Germany; Institute of Software Security, Hamburg University of Technology, Hamburg, Germany","2022 IEEE 22nd International Conference on Software Quality, Reliability and Security (QRS)","20 Mar 2023","2022","","","896","906","GitHub is a popular data repository for code examples. It is being continuously used to train several AI-based tools to automatically generate code. However, the effectiveness of such tools in correctly demonstrating the usage of cryptographic APIs has not been thoroughly assessed. In this paper, we investigate the extent and severity of misuses, specifically caused by incorrect cryptographic API call sequences in GitHub. We also analyze the suitability of GitHub data to train a learning-based model to generate correct cryptographic API call sequences. For this, we manually extracted and analyzed the call sequences from GitHub. Using this data, we augmented an existing learning-based model called DeepAPI to create two security-specific models that generate cryptographic API call sequences for a given natural language (NL) description. Our results indicate that it is imperative to not neglect the misuses in API call sequences while using data sources like GitHub, to train models that generate code.","2693-9177","978-1-6654-7704-8","10.1109/QRS57517.2022.00094","","https://ieeexplore.ieee.org/stamp/stamp.jsp?arnumber=10062390","Cryptography;APIs;JCA;security;API misuses","Training;Computer languages;Codes;Natural languages;Software quality;Programming;Data models","","1","","25","IEEE","20 Mar 2023","","","IEEE","IEEE Conferences"
"A Semantic Workbench for Editing, Querying, Navigating and Distributing Ontologies for Cognitive Manufacturing","B. R. Ferrer; W. M. Mohammed; J. L.; M. Lastra; S. Strzelczak","Faculty of Engineering and Natural Sciences, FAST-Lab, Tampere University, P. O. Box. 600, Tampere, Finland; Faculty of Engineering and Natural Sciences, FAST-Lab, Tampere University, P. O. Box. 600, Tampere, Finland; FAST-Lab, Tampere University, Tampere, Finland; Faculty of Engineering and Natural Sciences, FAST-Lab, Tampere University, P. O. Box. 600, Tampere, Finland; Faculty of Production Engineering, Lab of Industrial Ecosystemics, Warsaw University of Technology, Warsaw, Poland","IECON 2019 - 45th Annual Conference of the IEEE Industrial Electronics Society","9 Dec 2019","2019","1","","2767","2772","Manufacturing-oriented enterprises are investing in novel solutions to adapt their cyber and physical resources to the fast and, yet, unexpected changes of global industrial environment. One of the important trends is to work towards development of cognitive systems which are capable to process and analyze complex data using Artificial Intelligence (AI)-based tools and techniques. Therefore, cognition can be already viewed as a requirement for hyper-connected environments e.g., the factories of the future or the Internet of Things (IoT). In this context, there is a need to represent and store the data collected from machines in a format that can be understood and manipulated by both humans and machines. This is feasible by designing and implementing semantic models i.e., ontologies which, in turn, enable inferring implicit data of explicit knowledge, leading to cognition. Moreover, there is a need of granting the access to such information remotely and at system runtime. Within this conceptual article, the authors present a semantic workbench that was developed during a European project aiming at utilization of ontologies for knowledge representation and reasoning in industrial automation systems. Further, this research work proposes the encapsulation of semantic workbench as a service in order to be deployed in cloud-based platforms, hence, enabling remote access of authorized clients at system runtime. The proposed functionalities are also of critical importance in highly complex and distributed environments, like the IoT or industrial ecosystems.","2577-1647","978-1-7281-4878-6","10.1109/IECON.2019.8927430","","https://ieeexplore.ieee.org/stamp/stamp.jsp?arnumber=8927430","Cognitive manufacturing;industrial internet;knowledge representation;ontology;cloud-based systems","Ontologies;Semantics;Cognition;Manufacturing;Cloud computing;Production facilities;Industries","","","","40","IEEE","9 Dec 2019","","","IEEE","IEEE Conferences"
"KIAAA: An AI Assistant for Teaching Programming in the Field of Automation","S. Eilermann; L. Wehmeier; O. Niggemann; A. Deuter","Computer science in mechanical engineering, Helmut-Schmidt University, Hamburg, Germany; Computer science for engineering and production, University of applied Science and Arts Ostwestfalen-Lippe, Lemgo, Germany; Computer science in mechanical engineering, Helmut-Schmidt University, Hamburg, Germany; Computer science for engineering and production, University of applied Science and Arts Ostwestfalen-Lippe, Lemgo, Germany","2023 IEEE 21st International Conference on Industrial Informatics (INDIN)","22 Aug 2023","2023","","","1","7","Especially in highly interdisciplinary fields such as automation engineering, contemporary programming education with tailored assignments and individual feedback is a major challenge for educational institutions due to the increasing number of students per teacher and the ever-increasing demand for computer science professionals. To address this gap, we present ”KIAAA” an AI Assistant for Automation Engineering Teaching, a work-in-progress approach for an integrated, customized, and AI-based learning support system for automation and programming courses based on instructor-defined course objectives. Thereby in the KIAAA system, the individual knowledge level of the students is determined and individually tailored virtual learning scenarios are generated based on the knowledge and learning profile of the students. These are iteratively adapted based on the answers given. To achieve this, KIAAA uses several AI components, a hybrid rule-based scenario generation component, a Help-DKT-based cognitive model, and a solution assessor that uses a combination of traditional code analysis methods and AI-based analyses methods for automated programming task assessment. These components are the main parts of KIAAA to generate customized programming scenarios as well as visualization and simulation based on a modern game and physics engine.","2378-363X","978-1-6654-9313-0","10.1109/INDIN51400.2023.10218157","Ministry of Education; ","https://ieeexplore.ieee.org/stamp/stamp.jsp?arnumber=10218157","intelligent tutoring system;ai-based adaptive task generation;automated programming task assessment","Visualization;Automation;Education;Games;Hybrid power systems;Task analysis;Artificial intelligence","","","","43","IEEE","22 Aug 2023","","","IEEE","IEEE Conferences"
