"Space Applications of a Trusted AI Framework: Experiences and Lessons Learned","L. Mandrake; G. Doran; A. Goel; H. Ono; R. Amini; M. S. Feather; L. Fesq; P. Slingerland; L. Perry; B. Bycroft; J. Kaufman","Jet Propulsion Laboratory, California Institute of Technology, Pasadena, CA; Jet Propulsion Laboratory, California Institute of Technology, Pasadena, CA; Jet Propulsion Laboratory, California Institute of Technology, Pasadena, CA; Jet Propulsion Laboratory, California Institute of Technology, Pasadena, CA; Jet Propulsion Laboratory, California Institute of Technology, Pasadena, CA; Jet Propulsion Laboratory, California Institute of Technology, Pasadena, CA; Jet Propulsion Laboratory, California Institute of Technology, Pasadena, CA; The Aerospace Corporation, El Segundo, CA; The Aerospace Corporation, El Segundo, CA; The Aerospace Corporation, El Segundo, CA; The Aerospace Corporation, El Segundo, CA","2022 IEEE Aerospace Conference (AERO)","10 Aug 2022","2022","","","1","20","Artificial intelligence (AI), which encompasses machine learning (ML), has become a critical technology due to its well-established success in a wide array of applications. However, the proper application of AI remains a central topic of discussion in many safety-critical fields. This has limited its success in autonomous systems due to the difficulty of ensuring AI algorithms will perform as desired and that users will understand and trust how they operate. In response, there is growing demand for trustability in AI to address both the expectations and concerns regarding its use. The Aerospace Corporation (Aerospace) developed a Framework for Trusted AI (henceforth referred to as the framework) to encourage best practices for the implementation, assessment, and control of AI-based applications. It is generally applicable, being based on terms and definitions that cut across AI domains, and thus is a starting point for practitioners to tailor to their particular application. To help demonstrate how the framework can be tailored into mission assurance guidance for the space domain, Aerospace sought the involvement of the Jet Propulsion Laboratory (JPL) to engage with actual examples of AI-based space autonomy. We report here on the framework's application to two JPL projects. The first, Machine learning-based Analytics for Automated Rover Systems (MAARS), is a suite of algorithms that is intended to run onboard a rover to enhance its safety and productivity. The second, the Ocean Worlds Life Surveyor (OWLS), is comprised of an instrument suite and onboard software that is designed to search for life on an icy moon using microscopy and mass spectrometry while judiciously summarizing and prioritizing science data for downlink. Both MAARS and OWLS are intended to have minimal manual control while relying on complex autonomy software to operate within the unforgiving environment of deep space. Therefore, trusted AI for these systems is required for successful adoption of the autonomy software. To capture the needs for trust, interviews with a variety of JPL personnel responsible for developing autonomy solutions were conducted and are summarized here. Additionally, the application of the framework is presented as a means to lower the barrier for AI deployment. The intent of this document is to encourage researchers, engineers, and program managers to adopt new strategies when considering whether to leverage AI in autonomous systems.","1095-323X","978-1-6654-3760-8","10.1109/AERO53065.2022.9843322","Jet Propulsion Laboratory; California Institute of Technology; National Aeronautics and Space Administration(grant numbers:80NM0018D0004); ","https://ieeexplore.ieee.org/stamp/stamp.jsp?arnumber=9843322","","Machine learning algorithms;Autonomous systems;Space missions;OWL;Software;Artificial intelligence;Research and development","","12","","49","IEEE","10 Aug 2022","","","IEEE","IEEE Conferences"
"Model-Driven Prompt Engineering","R. Clarisó; J. Cabot","Universitat Oberta de Catalunya (UOC), Barcelona, Spain; Universitat Oberta de Catalunya (UOC), Barcelona, Spain","2023 ACM/IEEE 26th International Conference on Model Driven Engineering Languages and Systems (MODELS)","12 Dec 2023","2023","","","47","54","Generative artificial intelligence (AI) systems are capable of synthesizing complex content such as text, source code or images according to the instructions described in a natural language prompt. The quality of the output depends on crafting a suitable prompt. This has given rise to prompt engineering, the process of designing natural language prompts to best take advantage of the capabilities of generative AI systems.Through experimentation, the creative and research communities have created guidelines and strategies for creating good prompts. However, even for the same task, these best practices vary depending on the particular system receiving the prompt. Moreover, some systems offer additional features using a custom platform-specific syntax, e.g., assigning a degree of relevance to specific concepts within the prompt.In this paper, we propose applying model-driven engineering to support the prompt engineering process. Using a domain-specific language (DSL), we define platform-independent prompts that can later be adapted to provide good quality outputs in a target AI system. The DSL also facilitates managing prompts by providing mechanisms for prompt versioning and prompt chaining. Tool support is available thanks to a Langium-based Visual Studio Code plugin.","","979-8-3503-2480-8","10.1109/MODELS58315.2023.00020","","https://ieeexplore.ieee.org/stamp/stamp.jsp?arnumber=10343974","prompt engineering;model-driven engineering;domain-specific language;generative AI;large language models","Visualization;Source coding;Natural languages;Syntactics;Model driven engineering;DSL;Artificial intelligence","","","","52","IEEE","12 Dec 2023","","","IEEE","IEEE Conferences"
"Effects of Extended Stochastic Gradient Descent Algorithms on Improving Latent Factor-Based Recommender Systems","X. Luo; M. Zhou","Chongqing Engineering Research Center of Big Data Application for Smart Cities, and the Chongqing Key Laboratory of Big Data and Intelligent Computing, Chongqing Institute of Green and Intelligent Technology, Chinese Academy of Sciences, Chongqing, China; Department of Electrical and Computer Engineering, New Jersey Institute of Technology, Newark, NJ, USA","IEEE Robotics and Automation Letters","28 Jan 2019","2019","4","2","618","624","High-dimensional and sparse (HiDS) matrices from recommender systems contain various useful patterns. A latent factor (LF) analysis is highly efficient in grasping these patterns. Stochastic gradient descent (SGD) is a widely adopted algorithm to train an LF model. Can its extensions be capable of further improving an LF models' convergence rate and prediction accuracy for missing data? To answer this question, this work selects two of representative extended SGD algorithms to propose two novel LF models. Experimental results from two HiDS matrices generated by real recommender systems show that compared standard SGD, extended SGD algorithms enable an LF model to achieve a higher prediction accuracy for missing data of an HiDS matrix, a faster convergence rate, and a larger model diversity.","2377-3766","","10.1109/LRA.2019.2891986","National Natural Science Foundation of China(grant numbers:61772493,91646114); Chongqing Research Program of Technology Innovation and Application(grant numbers:cstc2017rgzn-zdyfX0020,cstc2017zdcy-zdyf0554,cstc2017rgzn-zdyf0118); Chongqing Cultivation Program of Innovation and Entrepreneurship Demonstration(grant numbers:cstc2017kjrc-cxcytd0149); Chongqing Overseas Scholars Innovation Program(grant numbers:cx2017012,cx2018011); Chinese Academy of Sciences; ","https://ieeexplore.ieee.org/stamp/stamp.jsp?arnumber=8607099","Big data in robotics and automation;AI-based methods;machine learning","Data models;Stochastic processes;Predictive models;Recommender systems;Standards;Prediction algorithms;Convergence","","14","","35","IEEE","10 Jan 2019","","","IEEE","IEEE Journals"
"Ethical Chatbot Design for Reducing Negative Effects of Biased Data and Unethical Conversations","J. Bang; S. Kim; J. W. Nam; D. -G. Yang","Electronics and Telecommunications Research Institute, Daejun, Republic of Korea; Ewha Womans University, Seoul, Republic of Korea; University of Science and Technology, Daejun, Republic of Korea; University of Science and Technology, Daejun, Republic of Korea","2021 International Conference on Platform Technology and Service (PlatCon)","20 Jan 2022","2021","","","1","5","AI technology is being introduced into various public and private service domains, transforming existing computing systems or creating new ones. While AI technologies can provide benefits to humans and society, the unexpected consequences (e.g., malfunctions) of AI systems can cause social losses. For this reason, research on ethical design for the development of AI-based systems is becoming important. In this paper, from existing studies on AI ethics, general guidelines such as transparency, explainability, predictability, accountability, fairness, privacy, and control for the ethical design of AI systems are reviewed. And, based on the ethical design guidelines, we discuss ethical design to reduce the negative effects of biased data and unethical dialogues in AI-based conversational chatbots.","","978-1-6654-1766-2","10.1109/PlatCon53246.2021.9680760","Korean National Police Agency; ","https://ieeexplore.ieee.org/stamp/stamp.jsp?arnumber=9680760","conversational chatbot;ethical design;framework","Ethics;Privacy;Systematics;Chatbots;Social factors;Stakeholders;Artificial intelligence","","7","","33","IEEE","20 Jan 2022","","","IEEE","IEEE Conferences"
"Applying a Trustworthy AI Framework to Mitigate Bias and Increase Workforce Gender Diversity","X. M. Liu; D. Murphy","School of Technology and Innovation, Marymount University, Arlington, Virginia, USA; School of Technology and Innovation, Marymount University, Arlington, Virginia, USA","2022 IEEE International Symposium on Technology and Society (ISTAS)","28 Aug 2023","2022","1","","1","5","Organizations increasingly use artificial intelligence (AI) technologies in their screening and recruiting process. However, AI-enabled recruiting and talent management tools have also introduced risks of unfair bias that may compromise workforce diversity. This conceptual paper frames an ethical discussion regarding gender equity in AI-enabled workforce decision applications. The authors examined several real-world cases in which AI was used in talent acquisition. The ensuing question is whether the use of AI in the hiring process can be turned into an advantage to improve gender equity. To address the question, a multi-faceted trustworthy AI framework was reviewed and applied to the workforce decision context. A list of implementation guidelines is proposed to mitigate bias and increase diversity in the IT workforce. The authors aim to stimulate further discussions and investigation on this complex topic and to call for action to develop educational programs or awareness campaigns on trustworthy AI, so improving gender equity in technology hiring.","2158-3412","978-1-6654-8410-7","10.1109/ISTAS55053.2022.10227119","","https://ieeexplore.ieee.org/stamp/stamp.jsp?arnumber=10227119","Artificial intelligence (AI);bias;trustworthy;gender equity;diversity;workforce","Training;Ethics;Gender equity;Shape;Software;Regulation;Artificial intelligence","","","","38","IEEE","28 Aug 2023","","","IEEE","IEEE Conferences"
"AI Based Chat-Bot Using Azure Cognitive Services","K. Tajane; S. Dave; P. Jahagirdar; A. Ghadge; A. Musale","Department of Computer Engineering, Pimpri Chinchwad College of Engineering, Pune, India; Department of Computer Engineering, Pimpri Chinchwad College of Engineering, Pune, India; Department of Computer Engineering, Pimpri Chinchwad College of Engineering, Pune, India; Department of Computer Engineering, Pimpri Chinchwad College of Engineering, Pune, India; Department of Computer Engineering, Pimpri Chinchwad College of Engineering, Pune, India","2018 Fourth International Conference on Computing Communication Control and Automation (ICCUBEA)","25 Apr 2019","2018","","","1","4","Letters ruled the earlier era in communication. Then with emergence of Telephones and subsequently mobile phones, voice conversations ruled the communication. However, currently, with the emergence of Internet and lots of social media, chat conversations are ruling the world. Think of your closest friend and ask yourself, have you talked more or chatted more? So, with popularity of chat in today's world, many technologists envisioned that chat couldn't just be a mode of communication between humans but also between a human and a computer. That's what chat-bot is. In some cases it is powered by machine learning (the more you interact with the chat-bot the smarter it gets). Or, more commonly, it is driven using intelligent rules (i.e. if a person says this, respond with that). A chat-bot can be useful in providing services in a variety of scenarios. These services include life-saving health messages, it may also include weather forecast or to purchase a new laptop, smartphone, and anything else in between. Many of the big companies like Google (Google Assistant), Amazon (Alexa), Microsoft (Cortana) and Oracle are spending good amount of energy and money for research on personal assistants. The following subjects would be touched upon for the development of chat-bot: · Using Azure Bot Architecture · Using NLP for Language Understanding from the user and for the Language Generation · Using Custom Vision services for the image recognition.","","978-1-5386-5257-2","10.1109/ICCUBEA.2018.8697737","","https://ieeexplore.ieee.org/stamp/stamp.jsp?arnumber=8697737","Azure;NLP;Computer Vision","","","5","","19","IEEE","25 Apr 2019","","","IEEE","IEEE Conferences"
"AI-Based Military Decision Support Using Natural Language","M. Möbius; D. Kallfass; T. Doll; D. Kunde","Dept. Operational Analysis and Studies, Airbus Defence and Space GmbH, Immenstaad, Germany; Dept. Operational Analysis and Studies, Airbus Defence and Space GmbH, Immenstaad, Germany; Army Concepts and Capabilities Development Centre, Division I, Cologne, Germany; German Army Headquarters von-Hardenberg-Kaserne, Strausberg, Germany","2022 Winter Simulation Conference (WSC)","23 Jan 2023","2022","","","1","12","To mimic a realistic representation of military operations, serious combat simulations require sound tactical behavior from modeled entities. Therefore, one must define combat tactics, doctrines, rules of engagement, and concepts of operation. Reinforcement learning has been proven to generate a broad range of tactical actions within the behavioral boundaries of the involved entities. In a multi-agent ground combat scenario, this paper demonstrates how our artificial intelligence (AI) application develops strategies and provides orders to subsidiary units while conducting missions accordingly. We propose a combined approach where human knowledge and responsibility collaborate with an AI system. To communicate on a common level, the orders and actions imposed by AI are given in natural language. This empowers the human operator to act in a human-on-the-loop role in order to validate and evaluate the reasoning of AI. This paper showcases the successful integration of natural language into the reinforcement learning process.","1558-4305","978-1-6654-7661-4","10.1109/WSC57314.2022.10015234","","https://ieeexplore.ieee.org/stamp/stamp.jsp?arnumber=10015234","","Visualization;Natural languages;Reinforcement learning;Cognition;Artificial intelligence","","","","12","IEEE","23 Jan 2023","","","IEEE","IEEE Conferences"
"AI Based Smart Remedial Observants in COVID-19 Crisis","S. Kumar; A. Panwal; S. Gharat; N. Ghatte; D. Karia","Electronics Department, Sardar Patel Institute of Technology, Mumbai, India; Electronics Department, Sardar Patel Institute of Technology, Mumbai, India; Electronics Department, Sardar Patel Institute of Technology, Mumbai, India; Electronics Department, Sardar Patel Institute of Technology, Mumbai, India; Electronics Department, Sardar Patel Institute of Technology, Mumbai, India","2021 International Conference on Communication information and Computing Technology (ICCICT)","12 Aug 2021","2021","","","1","5","Coronavirus disease (COVID-19) is a contagious [1] disease caused by becoming infected with severe acute respiratory syndrome coronavirus 2 (SARS-CoV-2) [2]. Numerous nations have acquainted social distancing measures to slow down the spread of the COVID-19 pandemic as people can spread the virus before they know they are sick. The solution focuses on a web-based solution to alert the residents and outsiders in case of any non-compliance of rules. In this work, an AI-powered solution is developed that leverages Machine learning based algorithm to guarantee that individuals are keeping up a safe distance from one another. A software-based approach is taken for providing a simple and engaging user experience to the user that will help the society and other authorities track and analyses the implications of such rules. The web application will be used to alert the users in case of any breaking of the law. Along with this, a system that detects if people are wearing a mask or not will also be verified by the algorithm. The model built can be deployed in the existing CCTV cameras to monitor each and every place of gathering without the need for any additional hardware systems.","","978-1-6654-0430-3","10.1109/ICCICT50803.2021.9510051","","https://ieeexplore.ieee.org/stamp/stamp.jsp?arnumber=9510051","Social Distancing;Mask Detection;OpenCV;Convolutional Neural Networks (CNN);Deep Learning;COVID","COVID-19;Pandemics;Surveillance;Neural networks;Nose;Human factors;Social factors","","","","15","IEEE","12 Aug 2021","","","IEEE","IEEE Conferences"
"Implementation of A Fuzzy Logic Progression For Alcohol Addicts Using Fuzzy Control System(FCS)","O. M. Omone; E. Aggrey; M. Takács; M. Kozlovszky","BioTech Research Center, EKIK, Óbuda University, Budapest, Hungary; Faculty of Informatics, University of Debrecen, Debrecen, Hungary; John von Neumann Faculty of Informatics, Óbuda University, Budapest, Hungary; John von Neumann Faculty of Informatics, Óbuda University, Budapest, Hungary","2020 IEEE 18th International Symposium on Intelligent Systems and Informatics (SISY)","8 Oct 2020","2020","","","161","166","The use of the Reduced Alcohol Intake (RAI) logic model is to help monitor alcoholic addicts and help them reduce alcohol intake for a better life and improved academic performance. The purpose of this study is to use the Mamdani Fuzzy Inference System (MFIS) component, which includes the application of a T-S (Takagi-Sugeno) model-based Fuzzy Control System (FCS) and a Fuzzy Logic System (FLS) as a rule-based system (Fuzzy Control System - FCS) to assemble all inputs in the RAI model to achieve classified fuzzy outputs. As initiated in the theoretical logic model (the RAI logic model), there is a direct identification of breakpoints for a transition between phases in the model. Thus, it can be used as an AI system that is efficient to monitor and examine the progression of alcohol addicts (to know what percentage of improvement they have reached overtime). Using the T-S method, the core parameters (motivation and self-determined state) of the RAI model were analyzed to find a linear interaction between the existing variables. In this paper, the variables of motivation and self-determined state are scaled between 0 to 10 to predict the level of improvement in percentage (%).","1949-0488","978-1-7281-7352-8","10.1109/SISY50555.2020.9217079","","https://ieeexplore.ieee.org/stamp/stamp.jsp?arnumber=9217079","Alcohol Addicts;Mamdani Fuzzy Inference System (MFIS);Motivation;Reduced Alcohol Intake (RAI) Logic Model;Self-determined State","Fuzzy logic;Fuzzy control;Alcoholic beverages;Fuzzy sets;Computational modeling;Monitoring;Predictive models","","1","","10","IEEE","8 Oct 2020","","","IEEE","IEEE Conferences"
"AI-based speed control models for the autonomous train: a literature review","A. Plissonneau; D. Trentesaux; W. Ben-Messaoud; A. Bekrar","LAMIH UMR CNRS 8201, UPHF Railenium, Valenciennes, France; LAMIH UMR CNRS 8201, UPHF Railenium, Valenciennes, France; Railenium, Valenciennes, France; LAMIH UMR CNRS 8201, UPHF Railenium, Valenciennes, France","2021 Third International Conference on Transportation and Smart Technologies (TST)","27 Aug 2021","2021","","","9","15","The railway industry recently showed interest in the potential use of AI to render trains autonomous in order to reduce cost and improve security and performance. This paper focuses on the integration of AI into Automatic Train Operation (ATO) systems to control train speed. The objective of this paper is to present and analyze a review of the literature made in that context. The review is done according to a typology based on three axis: the inputs and objectives of the model, the AI method used by authors and last, the validation process. Our review shows that AI based approaches outperform classical approaches and that learning based methods are superior to rule-based systems. Meanwhile, the contributions present incomplete validation processes, difficulties to generalize the proposed AI method and last, a lack of use of perceptual data during decision making. This analysis enables us to draw some prospects relevant to the solving of the listed limitations.","","978-1-6654-2903-0","10.1109/TST52996.2021.00009","","https://ieeexplore.ieee.org/stamp/stamp.jsp?arnumber=9516336","","Learning systems;Industries;Velocity control;Decision making;Transportation;Control systems;Rail transportation","","3","","23","IEEE","27 Aug 2021","","","IEEE","IEEE Conferences"
"A Spectroscopy-Based Sensor for the AI-Based Classification of Lipemic and Hematic Parameters","L. Carletti; D. Bagnoli; D. Paci; G. Ciuti","Department of Information Engineering, University of Pisa, Pisa, Italy; Medica S.p.A., Medolla, Italy; Medica S.p.A., Medolla, Italy; The BioRobotics Institute, Scuola Superiore Sant'Anna, Pisa, Italy","IEEE Sensors Letters","23 Oct 2023","2023","7","11","1","4","Dyslipidemias are chronic conditions characterized by elevated levels of LDL cholesterol and/or triglycerides in the bloodstream. Guidelines from the European Society of Cardiology recommended lipoprotein apheresis (LA) as the last-resort therapy for severe cases of familial hypercholesterolemia. However, LA devices equipped with a blood leak detector (BLD) sensor often generate false alarms due to turbidity caused by serum lipoproteins. This letter presents a protocol for creating hyperlipemic plasma samples and proposes the use of a microspectrometer-based BLD sensor to collect the spectra. Furthermore, to address the false alarm problem (blood rate ≥0.7%), we developed a first approach using thresholding and linear support vector machine (SVM). In addition, to improve data classification performance, three artificial neural networks (ANNs) were developed with different classification tasks, then applied to four different databases. ANNs aim to solve the problem of false alarms and accurately classify samples based on blood and phospholipids concentration, achieving 99% accuracy for data classification based on the combination of phospholipids and blood percentage.","2475-1472","","10.1109/LSENS.2023.3316878","","https://ieeexplore.ieee.org/stamp/stamp.jsp?arnumber=10258326","Sensor applications;microspectrometer-based sensor;artificial neural network (ANN);biomedical sensors;blood leak detector (BLD);lipoprotein apheresis (LA)","Blood;Sensors;Plasmas;Databases;Task analysis;Support vector machines;Optical variables measurement","","","","18","IEEE","22 Sep 2023","","","IEEE","IEEE Journals"
